{
  "api_budget_sensitive": true,
  "changes": {
    "MOONSHOT_MICRO_LOTTERY_AMOUNT_SOL": 0.01,
    "MOONSHOT_MICRO_LOTTERY_BIRTH_VELOCITY_MAX_AGE_MIN": 3,
    "MOONSHOT_MICRO_LOTTERY_BIRTH_VELOCITY_MAX_MCAP_USD": 15000,
    "MOONSHOT_MICRO_LOTTERY_BIRTH_VELOCITY_MAX_PRICE5M": 180,
    "MOONSHOT_MICRO_LOTTERY_BIRTH_VELOCITY_MAX_TXNS_5M": 40,
    "MOONSHOT_MICRO_LOTTERY_BIRTH_VELOCITY_MAX_VOLUME_24H": 3000,
    "MOONSHOT_MICRO_LOTTERY_BIRTH_VELOCITY_MIN_PRICE5M": 35,
    "MOONSHOT_MICRO_LOTTERY_BIRTH_VELOCITY_MIN_TXNS_5M": 15,
    "MOONSHOT_MICRO_LOTTERY_BIRTH_VELOCITY_MIN_VOLUME_24H": 800,
    "MOONSHOT_MICRO_LOTTERY_CLUSTER_TAIL_AMOUNT_SOL": 0.002,
    "MOONSHOT_MICRO_LOTTERY_CLUSTER_TAIL_MAX_AGE_MIN": 8,
    "MOONSHOT_MICRO_LOTTERY_CLUSTER_TAIL_MAX_MCAP_USD": 250000,
    "MOONSHOT_MICRO_LOTTERY_CLUSTER_TAIL_MIN_LIQUIDITY_USD": 5000,
    "MOONSHOT_MICRO_LOTTERY_CLUSTER_TAIL_MIN_MCAP_USD": 10000,
    "MOONSHOT_MICRO_LOTTERY_CLUSTER_TAIL_MIN_VOLUME_24H": 40000,
    "MOONSHOT_MICRO_LOTTERY_CONFIRMATION_PNL": 100,
    "MOONSHOT_MICRO_LOTTERY_EXTREME_CLUSTER_MAX_PRICE_IMPACT_PCT": 12,
    "MOONSHOT_MICRO_LOTTERY_EXTREME_CLUSTER_MIN_REAL_LIQUIDITY_USD": 15000,
    "MOONSHOT_MICRO_LOTTERY_EXTREME_CLUSTER_REQUIRE_REAL_LIQUIDITY": true,
    "MOONSHOT_MICRO_LOTTERY_EXTREME_MIN_TXNS_5M": 200,
    "MOONSHOT_MICRO_LOTTERY_HARD_STOP_PCT": 20,
    "MOONSHOT_MICRO_LOTTERY_LATE_PROXY_MAX_MCAP_USD": 100000,
    "MOONSHOT_MICRO_LOTTERY_LATE_PROXY_MAX_PRICE5M": 1000,
    "MOONSHOT_MICRO_LOTTERY_LATE_PROXY_MAX_TXNS_5M": 100,
    "MOONSHOT_MICRO_LOTTERY_LATE_PROXY_MIN_MCAP_USD": 15000,
    "MOONSHOT_MICRO_LOTTERY_LATE_PROXY_MIN_PRICE5M": 400,
    "MOONSHOT_MICRO_LOTTERY_LATE_PROXY_MIN_TXNS_5M": 15,
    "MOONSHOT_MICRO_LOTTERY_MAX_AGE_MIN": 8,
    "MOONSHOT_MICRO_LOTTERY_MAX_DAILY_BUYS": 0,
    "MOONSHOT_MICRO_LOTTERY_MAX_MCAP_USD": 100000,
    "MOONSHOT_MICRO_LOTTERY_MAX_OPEN": 0,
    "MOONSHOT_MICRO_LOTTERY_MIN_PRICE5M": 500,
    "MOONSHOT_MICRO_LOTTERY_MIN_TXNS_5M": 80,
    "MOONSHOT_MICRO_LOTTERY_MOONBAG_FRACTION": 0.15,
    "MOONSHOT_MICRO_LOTTERY_NO_EXPANSION_EXIT_S": 90,
    "MOONSHOT_MICRO_LOTTERY_RISKY_CLUSTER_AMOUNT_SOL": 0.0002,
    "MOONSHOT_MICRO_LOTTERY_TIME_STOP_MAX_PNL_PCT": 10,
    "MOONSHOT_MICRO_LOTTERY_TIME_STOP_MIN": 3,
    "MOONSHOT_MICRO_LOTTERY_TP1_FRACTION": 0.25,
    "MOONSHOT_MICRO_LOTTERY_TP1_PCT": 40,
    "MOONSHOT_MICRO_LOTTERY_TP2_FRACTION": 0.15,
    "MOONSHOT_MICRO_LOTTERY_TP2_PCT": 100,
    "MOONSHOT_MICRO_LOTTERY_TP3_FRACTION": 0.3,
    "MOONSHOT_MICRO_LOTTERY_TP3_PCT": 1000,
    "MOONSHOT_MICRO_LOTTERY_TP4_FRACTION": 0.2,
    "MOONSHOT_MICRO_LOTTERY_TP4_PCT": 2000
  },
  "created_at_utc": "2026-07-06T16:33:31.045398+00:00",
  "expected_effect": {
    "increase_moonshot_capture": true,
    "increase_pnl": true,
    "increase_win_rate": false,
    "reduce_severe_losses": true
  },
  "experiment_type": "replay",
  "hypothesis": "Improve moonshot tail capture with confirmed micro entries.",
  "live_allowed": false,
  "optimization_scope": "combined",
  "optimization_targets": [
    "moonshot_peak100_capture",
    "moonshot_peak500_capture",
    "moonshot_peak1000_capture",
    "moonshot_micro_tail_capture_ratio"
  ],
  "optimized_metric": "moonshot_peak100_capture",
  "proposal_id": "ar_moonshot_micro_s3939298838_0000_3f1d5fe6db",
  "required_gates": [
    "replay_positive",
    "api_budget_ok"
  ],
  "risk_notes": [
    "paper only",
    "moonshot amount capped"
  ],
  "target_lanes": [
    "pump_early_moonshot_micro_lottery"
  ]
}