{
  "api_budget_sensitive": true,
  "changes": {
    "SHADOW_FOLLOWUP_MICRO_AMOUNT_SOL": 0.02,
    "SHADOW_FOLLOWUP_MICRO_HARD_STOP_PCT": 20,
    "SHADOW_FOLLOWUP_MICRO_MAX_DAILY_BUYS": 0,
    "SHADOW_FOLLOWUP_MICRO_MAX_OPEN": 0,
    "SHADOW_FOLLOWUP_MICRO_MOONBAG_FRACTION": 0.3,
    "SHADOW_FOLLOWUP_MICRO_TIME_STOP_MIN": 3,
    "SHADOW_FOLLOWUP_MICRO_TP1_FRACTION": 0.4,
    "SHADOW_FOLLOWUP_MICRO_TP1_PCT": 35,
    "SHADOW_FOLLOWUP_MICRO_TP2_FRACTION": 0.3,
    "SHADOW_FOLLOWUP_MICRO_TP2_PCT": 60,
    "SHADOW_FOLLOWUP_MICRO_TP3_FRACTION": 0.3,
    "SHADOW_FOLLOWUP_MICRO_TP3_PCT": 250,
    "SHADOW_FOLLOWUP_TRIGGER_PNL_3M": 35,
    "SHADOW_FOLLOWUP_TRIGGER_PNL_6M": 75
  },
  "created_at_utc": "2026-06-20T23:30:42.466072+00:00",
  "expected_effect": {
    "increase_moonshot_capture": true,
    "increase_pnl": true,
    "increase_win_rate": true,
    "reduce_severe_losses": true
  },
  "experiment_type": "replay",
  "hypothesis": "Improve shadow follow-up conversion by tuning trigger and micro sizing.",
  "live_allowed": false,
  "optimization_scope": "combined",
  "optimization_targets": [
    "avg_pnl_pct",
    "median_pnl_pct",
    "total_pnl_usd",
    "severe_loss_count"
  ],
  "optimized_metric": "avg_pnl_pct",
  "proposal_id": "ar_shadow_followup_micro_s1007309083_0002_f5b9aac5a4",
  "required_gates": [
    "replay_positive",
    "api_budget_ok"
  ],
  "risk_notes": [
    "paper only",
    "micro amount capped"
  ],
  "target_lanes": [
    "shadow_followup_micro"
  ]
}