{
  "api_budget_sensitive": true,
  "changes": {
    "BIRD_TP1_FRACTION": 0.35,
    "BIRD_TP1_PCT": 20,
    "BIRD_TP2_FRACTION": 0.3,
    "BIRD_TP2_PCT": 50,
    "BIRD_TP3_FRACTION": 0.25,
    "BIRD_TP3_PCT": 150,
    "BIRD_TP4_FRACTION": 0.2,
    "BIRD_TP4_PCT": 300,
    "BIRD_TP5_FRACTION": 0.1,
    "BIRD_TP5_PCT": 1000,
    "BIRD_TP6_FRACTION": 0.03,
    "BIRD_TP6_PCT": 1000,
    "RUNNER_FLOOR_PEAK_100": 70,
    "RUNNER_FLOOR_PEAK_1000": 700,
    "RUNNER_FLOOR_PEAK_2000": 1000,
    "RUNNER_FLOOR_PEAK_300": 200,
    "RUNNER_FLOOR_PEAK_700": 450,
    "RUNNER_GIVEBACK_PEAK_1000_MAX_GIVEBACK": 300,
    "RUNNER_GIVEBACK_PEAK_100_MAX_GIVEBACK": 18,
    "RUNNER_GIVEBACK_PEAK_2000_MAX_GIVEBACK": 320,
    "RUNNER_GIVEBACK_PEAK_300_MAX_GIVEBACK": 40,
    "RUNNER_GIVEBACK_PEAK_700_MAX_GIVEBACK": 160
  },
  "created_at_utc": "2026-06-19T14:11:57.941679+00:00",
  "expected_effect": {
    "increase_moonshot_capture": true,
    "increase_pnl": true,
    "increase_win_rate": false,
    "reduce_severe_losses": false
  },
  "experiment_type": "replay",
  "hypothesis": "Improve runner capture by tuning partial take-profit ladder and floors.",
  "live_allowed": false,
  "optimization_scope": "combined",
  "optimization_targets": [
    "runner_capture_ratio",
    "realized_pnl_on_runners",
    "total_pnl_usd"
  ],
  "optimized_metric": "runner_capture_ratio",
  "proposal_id": "ar_runner_ladder_s3895826640_0002_6ccc06286e",
  "required_gates": [
    "replay_positive",
    "api_budget_ok"
  ],
  "risk_notes": [
    "paper only",
    "exit parameters only"
  ],
  "target_lanes": [
    "runner_exit",
    "pump_early_pumpswap_profit"
  ]
}