{
  "api_budget_sensitive": true,
  "changes": {
    "PAPER_BOOTSTRAP_AMOUNT_SOL": 0.05,
    "PAPER_BOOTSTRAP_BLOCK_CLUSTER_BAD": false,
    "PAPER_BOOTSTRAP_MAX_AMOUNT_SOL": 0.1,
    "PAPER_BOOTSTRAP_MAX_DAILY_BUYS": 0,
    "PAPER_BOOTSTRAP_MAX_HOURLY_BUYS": 0,
    "PAPER_BOOTSTRAP_MAX_OPEN": 0,
    "PAPER_BOOTSTRAP_MAX_PRICE_IMPACT_PCT": 40,
    "PAPER_BOOTSTRAP_MAX_RUG_SCORE": 100,
    "PAPER_BOOTSTRAP_MIN_CLOSED_TRADES_READY": 50,
    "PAPER_BOOTSTRAP_MIN_SECONDS_BETWEEN_BUYS": 0,
    "PAPER_BOOTSTRAP_MODEL_ROWS_READY": 200
  },
  "created_at_utc": "2026-06-15T14:59:18.900820+00:00",
  "expected_effect": {
    "increase_moonshot_capture": true,
    "increase_pnl": true,
    "increase_win_rate": false,
    "reduce_severe_losses": false
  },
  "experiment_type": "replay",
  "hypothesis": "Accelerate clean cold-start data acquisition with paper bootstrap entries.",
  "live_allowed": false,
  "optimization_scope": "combined",
  "optimization_targets": [
    "idle_no_buy_hours",
    "total_pnl_usd",
    "overtrading_count",
    "severe_loss_count"
  ],
  "optimized_metric": "idle_no_buy_hours",
  "proposal_id": "ar_paper_bootstrap_grid_0000_f4a0896178",
  "required_gates": [
    "replay_positive",
    "api_budget_ok"
  ],
  "risk_notes": [
    "paper only",
    "bootstrap amount cap enforced; buy quotas remain unlimited"
  ],
  "target_lanes": [
    "paper_bootstrap",
    "pump_early_paper_bootstrap_micro"
  ]
}