{
  "api_budget_sensitive": true,
  "changes": {
    "SHADOW_FOLLOWUP_MICRO_AMOUNT_SOL": 0.01,
    "SHADOW_FOLLOWUP_MICRO_HARD_STOP_PCT": 20,
    "SHADOW_FOLLOWUP_MICRO_MAX_DAILY_BUYS": 0,
    "SHADOW_FOLLOWUP_MICRO_MAX_OPEN": 0,
    "SHADOW_FOLLOWUP_MICRO_MOONBAG_FRACTION": 0.2,
    "SHADOW_FOLLOWUP_MICRO_TIME_STOP_MIN": 2,
    "SHADOW_FOLLOWUP_MICRO_TP1_FRACTION": 0.5,
    "SHADOW_FOLLOWUP_MICRO_TP1_PCT": 20,
    "SHADOW_FOLLOWUP_MICRO_TP2_FRACTION": 0.3,
    "SHADOW_FOLLOWUP_MICRO_TP2_PCT": 100,
    "SHADOW_FOLLOWUP_MICRO_TP3_FRACTION": 0.2,
    "SHADOW_FOLLOWUP_MICRO_TP3_PCT": 125,
    "SHADOW_FOLLOWUP_REAL_LIQUIDITY_MAX_AGE_MIN": 15,
    "SHADOW_FOLLOWUP_REAL_LIQUIDITY_MAX_PRICE_IMPACT_PCT": 12,
    "SHADOW_FOLLOWUP_REAL_LIQUIDITY_MIN_RANK_SCORE": 50,
    "SHADOW_FOLLOWUP_REAL_LIQUIDITY_MIN_SCORE_TOTAL": 45,
    "SHADOW_FOLLOWUP_REAL_LIQUIDITY_MIN_TXNS_5M": 250,
    "SHADOW_FOLLOWUP_REAL_LIQUIDITY_MIN_VOLUME_24H": 10000,
    "SHADOW_FOLLOWUP_TRIGGER_PNL_3M": 20,
    "SHADOW_FOLLOWUP_TRIGGER_PNL_6M": 40
  },
  "created_at_utc": "2026-07-05T15:49:51.166946+00:00",
  "expected_effect": {
    "increase_moonshot_capture": true,
    "increase_pnl": true,
    "increase_win_rate": true,
    "reduce_severe_losses": true
  },
  "experiment_type": "replay",
  "hypothesis": "Improve shadow follow-up conversion by tuning trigger and micro sizing.",
  "live_allowed": false,
  "optimization_scope": "combined",
  "optimization_targets": [
    "real_liquidity_breakout_capture",
    "avg_pnl_pct",
    "median_pnl_pct",
    "total_pnl_usd",
    "severe_loss_count"
  ],
  "optimized_metric": "real_liquidity_breakout_capture",
  "proposal_id": "ar_shadow_followup_micro_s3163061994_0002_df15717cef",
  "required_gates": [
    "replay_positive",
    "api_budget_ok"
  ],
  "risk_notes": [
    "paper only",
    "micro amount capped"
  ],
  "target_lanes": [
    "shadow_followup_micro"
  ]
}